{
  "id": "hand-crossbow",
  "name": "Hand Crossbow",
  "source": "Circus System",
  "flavor": "A compact one-handed crossbow, easily hidden up a sleeve until the trick needs a bolt.",
  "category": "martial",
  "damage": {
    "die": "1d6",
    "type": "piercing"
  },
  "properties": [
    "ammunition",
    "light",
    "loading"
  ],
  "range": {
    "normal": 30,
    "long": 120
  },
  "parryProfile": {
    "canParry": false,
    "note": "A drawn, loaded crossbow is committed to the shot — there is nothing in that hand to intercept a melee blow with. Trying falls back to the empty-hands (unarmed) case."
  },
  "proficientClasses": [],
  "mastery": "Vex"
}